commit	status	description	cv_auc	test_auc_2005s2_full	test_auc_2005s2_4_5	test_auc_2006_full
7d0b368	keep	baseline (n_estimators=30, max_depth=6, lr=0.1)	0.7445	0.7479	0.7454	0.7155
74f86c5	keep	n_estimators=200, lr=0.05	0.7534	0.7580	0.7544	0.7152
235c8ab	keep	n_estimators=500, lr=0.03	0.7556	0.7604	0.7563	0.7147
72835a1	keep	n_estimators=1000, lr=0.02	0.7573	0.7626	0.7586	0.7140
43b944b	keep	max_depth=8	0.7623	0.7699	0.7627	0.7145
fec243b	keep	subsample=0.8, colsample_bytree=0.8	0.7635	0.7689	0.7636	0.7114
5b860e0	keep	add DepHour, DepMinute features	0.7673	0.7738	0.7684	0.7150
4be41a7	discard	add Route=Origin_Dest categorical (overfit, slow)	0.7482	N/A	N/A	N/A
89b6ba9	keep	max_depth=10	0.7750	0.7821	0.7758	0.7150
9490159	keep	min_child_weight=5	0.7843	0.7909	0.7852	0.7187
52e8665	keep	min_child_weight=10	0.7871	0.7937	0.7883	0.7202
adc2a58	keep	min_child_weight=20	0.7875	0.7939	0.7891	0.7215
5c15f06	discard	min_child_weight=50 (too regularized)	0.7840	N/A	N/A	N/A
2a06041	keep	max_depth=12	0.7899	0.7969	0.7910	0.7222
1510f8b	keep	max_depth=14	0.7903	0.7983	0.7917	0.7230
05d0a8d	keep	cyclical encoding for DepHour (sin/cos)	0.7928	0.8009	0.7946	0.7250
a2b76e3	discard	cyclical encoding for Month, DayOfWeek (redundant w/ cat)	0.7919	N/A	N/A	N/A
d496c51	discard	add IsWeekend, IsRedeye binaries (redundant w/ existing)	0.7914	N/A	N/A	N/A
27a52b4	discard	gamma=1 (no effect)	0.7927	N/A	N/A	N/A
9385d86	keep	max_bin=512	0.7934	0.8014	0.7951	0.7253
9dffe08	discard	max_bin=1024 (gain ~ noise; keep simpler)	0.7936	N/A	N/A	N/A
934524b	discard	grow_policy=lossguide max_leaves=128	0.7872	N/A	N/A	N/A
36885e9	discard	add Carrier_Origin (over 60s budget)	0.7938	N/A	N/A	N/A
8ca9f4e	discard	depth=12 + n=1300 + lr=0.015	0.7927	N/A	N/A	N/A
51f218b	discard	HourDOW interaction (hurts)	0.7816	N/A	N/A	N/A
585f562	discard	reg_lambda=5	0.7925	N/A	N/A	N/A
d3e9d53	keep	max_cat_to_onehot=32 (one-hot low-card cats)	0.7977	0.8088	0.7997	0.7409
1ed04ee	discard	max_cat_to_onehot=350 (Origin/Dest one-hot hurts)	0.7840	N/A	N/A	N/A
3864acd	keep	max_depth=16	0.8002	0.8114	0.8019	0.7415
1b60376	keep	max_depth=18	0.8017	0.8136	0.8035	0.7421
cc0f5ef	keep	max_depth=20	0.8026	0.8149	0.8046	0.7425
2ba4790	keep	max_depth=24	0.8035	0.8162	0.8057	0.7425
4d77e18	keep	max_depth=32	0.8040	0.8168	0.8058	0.7425
4d0ef90	discard	mcw=10 (over budget 73.6s but +0.0081)	0.8121	N/A	N/A	N/A
43f0c2c	discard	mcw=10 + n=800 (over budget 61s)	0.8105	N/A	N/A	N/A
281df97	discard	mcw=10 + subsample=0.6 (over budget 63s)	0.8062	N/A	N/A	N/A
078b95a	keep	mcw=10 + n=700	0.8092	0.8223	0.8111	0.7457
6d20777	discard	mcw=5 + n=600 (over budget 68s)	0.8141	N/A	N/A	N/A
95a5464	keep	mcw=5 + n=500	0.8126	0.8267	0.8146	0.7480
e18ee45	discard	mcw=3 + n=400 (over budget 66s)	0.8139	N/A	N/A	N/A
5cbc182	discard	subsample=0.5 (too aggressive)	0.8026	N/A	N/A	N/A
9ff1b1b	discard	depth=24 + mcw=5 + n=600 (over budget 62.9s)	0.8134	N/A	N/A	N/A
46e415e	discard	remove DepTime	0.8043	N/A	N/A	N/A
4866e9c	discard	max_cat_threshold=256 (over budget 66.7s)	0.8127	N/A	N/A	N/A
efea4c2	discard	max_bin=256 (-0.001 alone)	0.8116	N/A	N/A	N/A
067f44c	discard	max_bin=256 + n=550	0.8124	N/A	N/A	N/A
2f8be9d	discard	colsample_bynode=0.8	0.8114	N/A	N/A	N/A
2bd2911	discard	depth=24 + mcw=3 + n=500 (over budget 69.5s)	0.8150	N/A	N/A	N/A
65e5d80	keep	depth=24 + mcw=3 + n=400	0.8130	0.8265	0.8142	0.7486
34e104b	discard	add CarrierHour interaction (over budget 76s)	0.8247	N/A	N/A	N/A
16e83e2	discard	+CarrierHour, n=300 (60.4s slightly over)	0.8212	N/A	N/A	N/A
423a9a5	keep	+CarrierHour, n=250	0.8185	0.8332	0.8207	0.7558
c5ca493	keep	+CarrierHour, n=280	0.8203	0.8353	0.8225	0.7563
5ab2073	discard	+CarrierMonth, n=200 (big regression)	0.7935	N/A	N/A	N/A
5753050	discard	+HourMonth, n=240 (big regression)	0.7940	N/A	N/A	N/A
0ec3d9c	discard	mcw=2 + n=240 (over budget 64s)	0.8205	N/A	N/A	N/A
8e52c33	keep	lr=0.03	0.8245	0.8399	0.8266	0.7562
d561952	keep	lr=0.05	0.8262	0.8422	0.8281	0.7539
0ee22d1	discard	lr=0.08 (slight reg)	0.8257	N/A	N/A	N/A
c27f6e6	keep	n=350	0.8277	0.8437	0.8297	0.7538
59ee415	keep	n=380	0.8279	0.8440	0.8300	0.7536
cc2175c	discard	lr=0.06 (flat)	0.8278	N/A	N/A	N/A
abbc36b	discard	mcw=2 + n=320 (over budget 61s)	0.8284	N/A	N/A	N/A
ed730f3	keep	mcw=2 + n=300	0.8281	0.8445	0.8302	0.7544
4cfa775	discard	+DistBand (over budget 60.3s, no gain)	0.8279	N/A	N/A	N/A
a57d904	discard	remove DepHour_sin/cos	0.8275	N/A	N/A	N/A
f5ac6d2	discard	remove DepMinute (huge regression)	0.8107	N/A	N/A	N/A
e7e637c	discard	+CarrierDOW, n=240 (regression)	0.7996	N/A	N/A	N/A
e5e1ba8	discard	OriginHour replace (over budget, high-card)	0.8140	N/A	N/A	N/A
769f79e	discard	max_delta_step=1	0.8275	N/A	N/A	N/A
f539a45	discard	mcw=2 n=320 max_bin=256	0.8275	N/A	N/A	N/A
c7d578d	discard	mcw=1 n=240 (over budget 70.6s)	0.8264	N/A	N/A	N/A
b204d78	discard	colsample_bytree=1.0 (over budget 66.8s)	0.8293	N/A	N/A	N/A
7422131	discard	cs=1.0 n=260 (over budget 62.1s)	0.8284	N/A	N/A	N/A
c61722c	discard	cs=1.0 n=240 (flat)	0.8280	N/A	N/A	N/A
f143b25	discard	depth=20 + n=340	0.8273	N/A	N/A	N/A
3bf68b9	discard	num_parallel_tree=2 n=150 (over budget 79s)	0.8252	N/A	N/A	N/A
4cc5b84	discard	cs=0.9 n=280 max_bin=256	0.8273	N/A	N/A	N/A
92413f2	discard	+DepMin (over budget 65s, flat)	0.8281	N/A	N/A	N/A
840930b	discard	mcw=4 n=380	0.8263	N/A	N/A	N/A
2218b0e	discard	random_state=0 (60.1s, noise)	0.8284	N/A	N/A	N/A
a456784	crash	gradient_based sampling (GPU only)	0.0000	N/A	N/A	N/A
8755fa5	discard	subsample=0.7	0.8259	N/A	N/A	N/A
ec11548	discard	+CarrierDistBand n=240	0.8259	N/A	N/A	N/A
06ff1f1	discard	shallow d=8 n=1300 (regime fails)	0.8008	N/A	N/A	N/A
13f8458	discard	cs=0.85 n=290	0.8279	N/A	N/A	N/A
1f3f1ff	discard	mcw=2.5	0.8276	N/A	N/A	N/A
df45363	discard	lr=0.06 n=280	0.8267	N/A	N/A	N/A
4f4a33a	discard	remove max_cat_to_onehot	0.8004	N/A	N/A	N/A
6a398bc	discard	depth=22 n=320 (60.4s over)	0.8279	N/A	N/A	N/A
aab9f8d	discard	HourDOW replace CarrierHour	0.7833	N/A	N/A	N/A
4f48cb9	keep	subsample=1.0 n=240	0.8283	0.8447	0.8315	0.7545
71bb8a9	keep	n=250	0.8285	0.8449	0.8318	0.7545
4b02c2c	keep	n=255	0.8286	0.8451	0.8319	0.7545
fce7651	keep	lr=0.06	0.8287	0.8457	0.8317	0.7540
a4c8f37	keep	lr=0.07	0.8293	0.8453	0.8322	0.7535
89e8ca5	discard	lr=0.08	0.8286	N/A	N/A	N/A
22185d1	keep	n=290	0.8301	0.8460	0.8330	0.7535
e347372	keep	n=310	0.8303	0.8462	0.8332	0.7536
e0361c9	keep	n=320	0.8305	0.8463	0.8333	0.7536
047781e	discard	n=325 (flat)	0.8305	N/A	N/A	N/A
5f7c8cd	discard	mcw=3 n=360	0.8295	N/A	N/A	N/A
1ab6550	discard	cs=0.9 n=300	0.8302	N/A	N/A	N/A
d577475	discard	cs=1.0 n=275	0.8298	N/A	N/A	N/A
5437602	discard	lr=0.075	0.8297	N/A	N/A	N/A
6008a73	discard	depth=28 n=300	0.8297	N/A	N/A	N/A
fbd5932	discard	max_bin=768 n=305	0.8299	N/A	N/A	N/A
ed02728	discard	+CarrierDOW (still fails)	0.8033	N/A	N/A	N/A
883d97d	discard	lr=0.065 (60.9s over)	0.8299	N/A	N/A	N/A
e2dad92	discard	feature_weights CarrierHour 2x	0.8292	N/A	N/A	N/A
bb321be	discard	depth=20 n=360	0.8300	N/A	N/A	N/A
5ab4ca7	discard	reg_alpha=0.1	0.8294	N/A	N/A	N/A
c02f7d6	keep	reg_lambda=0.5	0.8306	0.8471	0.8330	0.7535
8adeb3d	discard	reg_lambda=0.2	0.8304	N/A	N/A	N/A
5eb1a65	keep	n=330	0.8308	0.8473	0.8332	0.7535
e33524d	discard	n=345 (flat)	0.8308	N/A	N/A	N/A
7e6e98d	discard	subsample=0.95	0.8302	N/A	N/A	N/A
027313e	discard	cs=0.75	0.8299	N/A	N/A	N/A
24248f1	keep	max_depth=23	0.8309	0.8468	0.8334	0.7532
2b74397	discard	max_depth=22	0.8304	N/A	N/A	N/A
7df1589	discard	n=340 (flat)	0.8309	N/A	N/A	N/A
e221c22	discard	lr=0.072	0.8305	N/A	N/A	N/A
5beb1d1	discard	max_cat_to_onehot=20 (Carrier needed in one-hot)	0.8113	N/A	N/A	N/A
8014115	discard	cs=1.0 n=290	0.8296	N/A	N/A	N/A
66b66bf	discard	+DepHourFrac (62s over)	0.8308	N/A	N/A	N/A
db73191	discard	n=335 (flat)	0.8309	N/A	N/A	N/A
0ae2e11	discard	mcw=1 n=240 (over budget)	0.8295	N/A	N/A	N/A
none    	discard	lossguide max_leaves=1024 (over budget)	0.8262	N/A	N/A	N/A
4f728d0	discard	mcw=3 n=350	0.8293	N/A	N/A	N/A
3ace08b	discard	feature_weights Dist 3x (flat)	0.8309	N/A	N/A	N/A
none    	discard	tree_method=approx (way over budget)	0.8306	N/A	N/A	N/A
b5f09b7	discard	lr=0.073 (flat)	0.8309	N/A	N/A	N/A
1bdf276	discard	remove UniqueCarrier	0.8301	N/A	N/A	N/A
d5ba711	discard	remove DayofMonth	0.8280	N/A	N/A	N/A
0c476a3	discard	+DistBucket	0.8305	N/A	N/A	N/A
8a9aaa3	discard	reg_lambda=2	0.8289	N/A	N/A	N/A
7372022	keep	sub=0.95 cs=0.85	0.8310	0.8471	0.8335	0.7541
d6ffea9	discard	n=340 (flat)	0.8310	N/A	N/A	N/A
7085bf2	discard	sub=0.9 cs=0.9	0.8303	N/A	N/A	N/A
7bb5858	discard	lr=0.075	0.8309	N/A	N/A	N/A
20191f7	discard	depth=24 with new sub/cs	0.8306	N/A	N/A	N/A
f4e7803	discard	sub=1.0 cs=0.85	0.8304	N/A	N/A	N/A
317e142	discard	sub=0.95 cs=0.8	0.8302	N/A	N/A	N/A
fe809cd	discard	n=345 (flat)	0.8310	N/A	N/A	N/A
aabf5cd	discard	max_bin=384	0.8303	N/A	N/A	N/A
ce2a09b	discard	mcw=1.5 n=300 (62.6s over)	0.8310	N/A	N/A	N/A
5c92401	discard	gamma=0.05	0.8303	N/A	N/A	N/A
e0b468d	discard	colsample_bylevel=0.85	0.8304	N/A	N/A	N/A
b14cb27	discard	CarrierHour6 (coarser, lost info)	0.8195	N/A	N/A	N/A
89c3d9f	discard	+CarrierHour6 multi-grain	0.8283	N/A	N/A	N/A
c04f637	discard	max_cat_threshold=128 (60.9s over)	0.8314	N/A	N/A	N/A
aad0e3d	discard	max_cat_threshold=128 n=320 (60.8s over)	0.8313	N/A	N/A	N/A
b21413f	keep	max_cat_threshold=128 n=300	0.8311	0.8480	0.8336	0.7537
512842b	keep	n=310	0.8312	0.8481	0.8337	0.7537
2c61a8c	discard	n=315 (60s flat)	0.8312	N/A	N/A	N/A
978ed8e	keep	lr=0.075	0.8317	0.8480	0.8336	0.7533
7f5cbe3	discard	lr=0.08	0.8312	N/A	N/A	N/A
264e3be	discard	n=320 (flat)	0.8317	N/A	N/A	N/A
17a4227	discard	max_cat_threshold=192 n=305	0.8316	N/A	N/A	N/A
857837f	discard	max_cat_threshold=96	0.8308	N/A	N/A	N/A
4afd8ee	discard	depth=24 (with new setup)	0.8303	N/A	N/A	N/A
b4f8931	discard	n=315 (flat)	0.8317	N/A	N/A	N/A
35b84b6	discard	mcw=3 with new setup	0.8302	N/A	N/A	N/A
786e73f	discard	sub=1.0 with new setup	0.8304	N/A	N/A	N/A
498db40	discard	cs=0.9 (flat)	0.8317	N/A	N/A	N/A
24f25af	discard	max_cat_threshold=160	0.8313	N/A	N/A	N/A
7d10f59	discard	objective=binary:logitraw	0.8306	N/A	N/A	N/A
45c978b	discard	scale_pos_weight=1.05	0.8316	N/A	N/A	N/A
62ce7c4	discard	max_bin=1024 (over budget)	0.8311	N/A	N/A	N/A
6dc27e9	discard	max_bin=640	0.8311	N/A	N/A	N/A
2d3f5bd	discard	+DepHour_sq	0.8299	N/A	N/A	N/A
3113e7c	discard	remove Month	0.8273	N/A	N/A	N/A
d30b5a2	keep	remove DayOfWeek (simplification win!)	0.8330	0.8507	0.8361	0.7511
6b8ad9d	discard	also remove DayofMonth	0.8324	N/A	N/A	N/A
135593c	keep	remove DepHour_sin/cos	0.8332	0.8508	0.8362	0.7511
dbdc215	discard	remove DepHour numeric	0.8327	N/A	N/A	N/A
4de3bbd	discard	n=330 (flat)	0.8332	N/A	N/A	N/A
0c954da	discard	lr=0.08 (flat)	0.8332	N/A	N/A	N/A
98ef9a0	keep	remove UniqueCarrier	0.8336	0.8506	0.8365	0.7511
1b5db66	discard	remove DayofMonth	0.8305	N/A	N/A	N/A
8d51beb	keep	n=340	0.8337	0.8509	0.8367	0.7510
2fb8f97	keep	n=360	0.8338	0.8510	0.8368	0.7510
0ef5f89	discard	n=380 (60s boundary)	0.8339	N/A	N/A	N/A
c178e72	discard	depth=22 with new optimum	0.8336	N/A	N/A	N/A
b23367b	discard	lr=0.08 with simpler	0.8336	N/A	N/A	N/A
9ea306f	discard	mcw=3	0.8320	N/A	N/A	N/A
cce059d	discard	max_cat_threshold=160 with simpler	0.8336	N/A	N/A	N/A
e43b394	discard	remove DepMinute (still critical)	0.8179	N/A	N/A	N/A
051152e	discard	+HourDOW with simpler (still fails)	0.8077	N/A	N/A	N/A
7fa590e	discard	lr=0.07 (60.8s over)	0.8336	N/A	N/A	N/A
7954ecf	discard	reg_lambda=0.3	0.8335	N/A	N/A	N/A
e24aa60	discard	remove DepTime (still hurts)	0.8295	N/A	N/A	N/A
3cb8eed	discard	depth=25 n=340	0.8337	N/A	N/A	N/A
e803503	discard	cs=0.8 (flat)	0.8338	N/A	N/A	N/A
63688dd	discard	max_cat_threshold=256 n=320 (over)	0.8336	N/A	N/A	N/A
5d20812	discard	remove Dest	0.8212	N/A	N/A	N/A
d9c3734	discard	depth=22 n=370	0.8336	N/A	N/A	N/A
e7bdd97	discard	sub=0.92	0.8328	N/A	N/A	N/A
f07b9b2	discard	max_bin=400	0.8328	N/A	N/A	N/A
9599a00	discard	lr=0.077	0.8335	N/A	N/A	N/A
none    	discard	lossguide max_leaves=4096 (158s over)	0.8337	N/A	N/A	N/A
0248d0b	keep	lr=0.073	0.8340	0.8510	0.8361	0.7514
7b03834	discard	lr=0.072 (over budget)	0.8339	N/A	N/A	N/A
09ba14c	keep	lr=0.074	0.8341	0.8510	0.8368	0.7516
cea8299	discard	lr=0.076	0.8335	N/A	N/A	N/A
8a250fd	discard	n=370 (60.1s flat)	0.8341	N/A	N/A	N/A
4e682da	discard	sub=0.93	0.8330	N/A	N/A	N/A
6ebe0ad	discard	max_cat_threshold=144 (over)	0.8338	N/A	N/A	N/A
f4afdb6	discard	random_state=2025	0.8335	N/A	N/A	N/A
e1f69c4	discard	max_cat_to_onehot=64 (flat, equivalent)	0.8341	N/A	N/A	N/A
17da4ce	discard	sub=1.0 (60.6s over)	0.8341	N/A	N/A	N/A
