commit	status	description	cv_auc	test_auc_2005s2_full	test_auc_2005s2_4_5	test_auc_2006_full
a653082	keep	baseline: n_estimators=30 max_depth=6 lr=0.1	0.7445	0.7479	0.7454	0.7155
13c0f23	keep	exp1: n_estimators=500 lr=0.05 subsample=0.8 colsample=0.8 min_child_weight=5	0.7631	0.7667	0.7635	0.7133
f965727	keep	exp2: n_estimators=1000 lr=0.03	0.7642	0.7683	0.7646	0.7125
f411b24	keep	exp3: max_depth=8	0.7698	0.7753	0.7707	0.7077
6bf9642	keep	exp4: max_depth=10	0.7753	0.7820	0.7764	0.7080
ec6a028	crash	exp5: max_depth=12 OOM with n_jobs=-1	0.0000	N/A	N/A	N/A
20eb52d	keep	exp6: max_depth=12 CV n_jobs=2	0.7793	0.7867	0.7807	0.7112
72f6c43	discard	exp7: gamma=0.1 reg_alpha=0.01 reg_lambda=2.0	0.7789	N/A	N/A	N/A
1805e27	discard	exp8: Route interaction + DepHour extraction	0.7724	N/A	N/A	N/A
8411c65	discard	exp9: DepHour only (no Route)	0.7786	N/A	N/A	N/A
9dc6a49	crash	exp10: n_estimators=1500 lr=0.02 min_child_weight=1 OOM	0.0000	N/A	N/A	N/A
9612c80	discard	exp11: n_estimators=1500 lr=0.02 min_child_weight=1 n_jobs=2/1	0.7735	N/A	N/A	N/A
cee2fe8	keep	exp12: subsample=0.7 colsample_bytree=0.7	0.7828	0.7910	0.7838	0.7126
016eb99	keep	exp13: subsample=0.6 colsample_bytree=0.6	0.7841	0.7926	0.7853	0.7115
6007ff1	discard	exp14: subsample=0.5 colsample_bytree=0.5 (too aggressive)	0.7821	N/A	N/A	N/A
f34a982	keep	exp15: max_depth=14 CV n_jobs=1	0.7868	0.7960	0.7880	0.7137
a7cdd57	discard	exp16: colsample_bylevel=0.8 colsample_bynode=0.8	0.7804	N/A	N/A	N/A
94f8429	keep	exp17: max_depth=16	0.7883	0.7983	0.7896	0.7152
2df65c1	discard	exp18: grow_policy=lossguide max_leaves=256	0.7826	N/A	N/A	N/A
e6dad51	keep	exp19: min_child_weight=3	0.7892	0.7989	0.7906	0.7161
0d7590c	keep	exp20: max_depth=18	0.7906	0.8008	0.7921	0.7176
9336124	keep	exp21: max_depth=20	0.7912	0.8022	0.7926	0.7184
0203f6e	keep	exp22: max_depth=24	0.7914	0.8027	0.7933	0.7188
79d56ae	crash	exp23: n_estimators=2000 lr=0.01 depth=24 OOM	0.0000	N/A	N/A	N/A
f55d352	crash	exp24: n_estimators=2000 lr=0.01 depth=16 OOM	0.0000	N/A	N/A	N/A
2eb9a3f	crash	exp25: same as exp24 with n_jobs=2/1 still OOM	0.0000	N/A	N/A	N/A
66384d7	keep	exp26: max_bin=512	0.7931	0.8045	0.7950	0.7202
22ed896	keep	exp27: max_bin=1024	0.7945	0.8053	0.7957	0.7209
d669493	keep	exp28: max_bin=2048	0.7949	0.8058	0.7960	0.7215
a92fbf9	discard	exp29: max_cat_threshold=128	0.7937	N/A	N/A	N/A
fae6b25	keep	exp30: n_estimators=1500 lr=0.02 n_jobs=2/1	0.7953	0.8063	0.7970	0.7227
bf1d04b	discard	exp31: subsample=0.5 colsample_bytree=0.5	0.7927	N/A	N/A	N/A
06f1dd6	crash	exp32: min_child_weight=2 n_jobs=2 OOM	0.0000	N/A	N/A	N/A
8094360	crash	exp33: min_child_weight=2 n_jobs=1 still OOM	0.0000	N/A	N/A	N/A
83c411e	discard	exp34: 1000 trees lr=0.03 reg_lambda=1.5	0.7943	N/A	N/A	N/A
171e5fa	discard	exp35: max_depth=20 with 1500/0.02	0.7945	N/A	N/A	N/A
76f5396	discard	exp36: target encoding for Carrier/Origin/Dest	0.7908	N/A	N/A	N/A
cbf1c4b	keep	exp37: subsample=0.65 colsample_bytree=0.55	0.7962	0.8078	0.7979	0.7239
49568b0	discard	exp38: colsample_bytree=0.5 (tied)	0.7962	N/A	N/A	N/A
3242767	keep	exp39: subsample=0.7 colsample_bytree=0.5	0.7971	0.8089	0.7992	0.7251
5daf877	crash	exp40: subsample=0.75 colsample=0.45 OOM	0.0000	N/A	N/A	N/A
c1d0503	discard	exp41: subsample=0.75 colsample=0.45 max_bin=1024	0.7947	N/A	N/A	N/A
dfa82f3	crash	exp42: lr=0.015 OOM	0.0000	N/A	N/A	N/A
f42f2f5	discard	exp43: max_depth=28 (worse than 24)	0.7969	N/A	N/A	N/A
caaae62	discard	exp44: max_cat_to_onehot=1 (tied)	0.7971	N/A	N/A	N/A
09118ff	discard	exp45: colsample_bytree=0.45	0.7945	N/A	N/A	N/A
d8afabe	discard	exp46: frequency encoding Origin/Dest/Carrier	0.7946	N/A	N/A	N/A
c1df72e	discard	exp47: lossguide max_leaves=512	0.7901	N/A	N/A	N/A
ad46623	discard	exp48: cosine LR decay 0.05->0.005	0.7957	N/A	N/A	N/A
16b434b	discard	exp49: min_child_weight=5	0.7957	N/A	N/A	N/A
1b64291	keep	exp50: n_estimators=1200 lr=0.025	0.7975	0.8086	0.7988	0.7246
d395e79	discard	exp51: n_estimators=1300 lr=0.023	0.7970	N/A	N/A	N/A
bb82033	discard	exp52: n_estimators=1100 lr=0.028	0.7974	N/A	N/A	N/A
362c5c9	discard	exp53: reg_lambda=2	0.7964	N/A	N/A	N/A
b879298	keep	exp54: DepMinutes (HHMM->minutes since midnight)	0.8031	0.8151	0.8048	0.7326
c2e83e3	discard	exp55: remove DepTime keep only DepMinutes (worse)	0.7941	N/A	N/A	N/A
630b4c9	discard	exp56: add DepHour (redundant with DepMinutes)	0.8011	N/A	N/A	N/A
30df30a	keep	exp57: add DepMinuteOfHour	0.8078	0.8190	0.8093	0.7350
1668ee6	keep	exp58: sin/cos cyclic encoding of DepMinutes	0.8100	0.8208	0.8109	0.7380
99c2eb7	discard	exp59: sin/cos cyclic DepMinuteOfHour	0.8092	N/A	N/A	N/A
4b10cf7	keep	exp60: add LogDistance	0.8112	0.8233	0.8128	0.7404
88a8a82	discard	exp61: IsWeekend (redundant with DayOfWeek)	0.8096	N/A	N/A	N/A
5299fbb	discard	exp62: DepMinutes squared	0.8094	N/A	N/A	N/A
47b8f0a	discard	exp63: Distance*DepMinutes interaction	0.8107	N/A	N/A	N/A
17cdfc1	discard	exp64: max_depth=20 (tied)	0.8109	N/A	N/A	N/A
58003df	discard	exp65: colsample_bytree=0.6	0.8097	N/A	N/A	N/A
73ca72e	discard	exp66: 1000 trees lr=0.03 (simpler)	0.8104	N/A	N/A	N/A
57d4efb	keep	exp67: n_jobs=-1 (faster same AUC)	0.8112	0.8233	0.8128	0.7404
7223737	discard	exp68: MilesPerMin feature	0.8103	N/A	N/A	N/A
b6d0b2d	discard	exp69: IsAfternoon feature	0.8094	N/A	N/A	N/A
39e7184	discard	exp70: max_bin=4096 (tied)	0.8112	N/A	N/A	N/A
41ea98c	keep	exp71: gamma=0.05	0.8114	0.8232	0.8133	0.7400
6ddcd28	discard	exp72: gamma=0.1	0.8113	N/A	N/A	N/A
13558fe	discard	exp73: n_estimators=1400 lr=0.022	0.8113	N/A	N/A	N/A
d83188a	discard	exp74: subsample=0.65 colsample=0.55	0.8095	N/A	N/A	N/A
8e32f0b	discard	exp75: sin/cos DayOfWeek	0.8077	N/A	N/A	N/A
ec8e062	discard	exp76: reg_alpha=0.1	0.8108	N/A	N/A	N/A
bc6c2e4	discard	exp77: remove DepMinuteOfHour (critical feature!)	0.8042	N/A	N/A	N/A
84472ff	discard	exp78: DepMod5 and DepMod15	0.8077	N/A	N/A	N/A
38be085	discard	exp79: max_depth=22 (tied)	0.8113	N/A	N/A	N/A
f33179b	keep	exp80: DepHour as categorical	0.8131	0.8252	0.8146	0.7414
836bddc	discard	exp81: DayPeriod categorical (redundant)	0.8130	N/A	N/A	N/A
8765c52	discard	exp82: MonthNum numeric	0.8119	N/A	N/A	N/A
6a8341d	discard	exp83: min_child_weight=2	0.8130	N/A	N/A	N/A
841d6e6	discard	exp84: lr=0.02	0.8127	N/A	N/A	N/A
cb6a895	keep	exp85: DistBin categorical (short/medium/long/xlong)	0.8135	0.8255	0.8150	0.7419
b3404a0	discard	exp86: DayNum numeric	0.8109	N/A	N/A	N/A
e4e2092	discard	exp87: remove LogDistance (still helpful)	0.8122	N/A	N/A	N/A
0e7b4b2	discard	exp88: colsample_bytree=0.55	0.8119	N/A	N/A	N/A
5c5945c	keep	exp89: subsample=0.75	0.8140	0.8260	0.8156	0.7420
c5a8b4d	keep	exp90: subsample=0.8	0.8143	0.8268	0.8164	0.7430
d4c318c	keep	exp91: subsample=0.85	0.8151	0.8276	0.8166	0.7434
7559c0a	keep	exp92: subsample=0.9	0.8155	0.8281	0.8170	0.7436
6b718ef	keep	exp93: subsample=1.0	0.8157	0.8277	0.8168	0.7430
364d32e	discard	exp94: colsample_bytree=0.6	0.8111	N/A	N/A	N/A
1879682	discard	exp95: colsample_bytree=0.45 (tied)	0.8157	N/A	N/A	N/A
87a955c	crash	exp96: gamma=0 OOM	0.0000	N/A	N/A	N/A
2cff0e9	discard	exp97: 1000 trees lr=0.03	0.8154	N/A	N/A	N/A
63d90be	crash	exp98: Distance squared OOM	0.0000	N/A	N/A	N/A
8287006	discard	exp99: remove sin/cos (still needed)	0.8143	N/A	N/A	N/A
d8e798d	discard	exp100: gamma=0.1	0.8150	N/A	N/A	N/A
faef5ad	discard	exp101: max_depth=18	0.8144	N/A	N/A	N/A
7e92107	discard	exp102: 1100 trees lr=0.027	0.8148	N/A	N/A	N/A
0e62b21	discard	exp103: DowNum numeric	0.8146	N/A	N/A	N/A
d842c2b	discard	exp104: finer DistBin 6 bins (tied)	0.8157	N/A	N/A	N/A
8a879d2	discard	exp105: 1500 trees lr=0.02 max_bin=1024	0.8156	N/A	N/A	N/A
e947819	discard	exp106: max_depth=26	0.8152	N/A	N/A	N/A
d6d6200	discard	exp107: reg_lambda=1.5	0.8147	N/A	N/A	N/A
95a742f	discard	exp108: colsample_bylevel=0.9	0.8152	N/A	N/A	N/A
01630de	discard	exp109: subsample=0.95 (tied)	0.8156	N/A	N/A	N/A
0f207e6	keep	exp110: lr=0.03 with 1200 trees	0.8158	0.8278	0.8173	0.7426
ec8c4e1	discard	exp111: lr=0.035	0.8152	N/A	N/A	N/A
7214e6f	discard	exp112: min_child_weight=4	0.8142	N/A	N/A	N/A
b20a52c	discard	exp113: gamma=0.03	0.8152	N/A	N/A	N/A
1ec1e97	keep	exp114: DepTimeFloat (DepTime/100)	0.8163	0.8291	0.8181	0.7424
1e7a87b	discard	exp115: n_estimators=1300 (tied)	0.8163	N/A	N/A	N/A
2547463	crash	exp116: InvDist OOM	0.0000	N/A	N/A	N/A
aa51b5c	crash	exp117: replace sin/cos with InvDist OOM	0.0000	N/A	N/A	N/A
bfca4bc	discard	exp118: 1000 trees lr=0.035 n_jobs=2	0.8159	N/A	N/A	N/A
2dcd6e2	discard	exp119: 1300 trees max_bin=1536 (tied)	0.8163	N/A	N/A	N/A
89e7780	discard	exp120: max_depth=22 gamma=0.03	0.8160	N/A	N/A	N/A
4b1f1a6	discard	exp121: max_cat_to_onehot=1 (tied)	0.8163	N/A	N/A	N/A
e984550	crash	exp122: lr=0.028 OOM	0.0000	N/A	N/A	N/A
78f214c	discard	exp123: max_depth=20	0.8156	N/A	N/A	N/A
91b96b4	discard	exp124: SqrtDistance instead of LogDistance (tied)	0.8163	N/A	N/A	N/A
4d1b1bd	discard	exp125: DepTimeNorm instead of DepTimeFloat (tied)	0.8163	N/A	N/A	N/A
3059f61	keep	exp126: colsample_bytree=0.4	0.8171	0.8298	0.8189	0.7436
56c1e8f	crash	exp127: colsample_bytree=0.35 OOM	0.0000	N/A	N/A	N/A
f46951c	keep	exp128: subsample=0.95 colsample=0.4	0.8177	0.8302	0.8193	0.7442
bbe684e	discard	exp129: subsample=0.9	0.8171	N/A	N/A	N/A
7c94499	discard	exp130: gamma=0.03	0.8174	N/A	N/A	N/A
13aafe6	crash	exp131: lr=0.025 OOM	0.0000	N/A	N/A	N/A
60aea0a	discard	exp132: lr=0.025 n_jobs=2 (tied)	0.8177	N/A	N/A	N/A
15e0cc8	discard	exp133: colsample_bynode=0.9	0.8159	N/A	N/A	N/A
bdfc636	discard	exp134: max_delta_step=1	0.8172	N/A	N/A	N/A
8df0bd0	discard	exp135: max_depth=16	0.8158	N/A	N/A	N/A
e52f8fb	discard	exp136: 1000 trees lr=0.04	0.8172	N/A	N/A	N/A
0074871	discard	exp137: colsample_bytree=0.45 (tied)	0.8177	N/A	N/A	N/A
a9badb3	discard	exp138: DepTimeSqScaled (tied - tree invariant)	0.8177	N/A	N/A	N/A
30ee289	crash	exp139: DistRank OOM	0.0000	N/A	N/A	N/A
45ec565	discard	exp140: remove DepTimeFloat (hurts with colsample=0.4)	0.8159	N/A	N/A	N/A
cf49d2b	discard	exp141: 1100 trees lr=0.032	0.8174	N/A	N/A	N/A
fc5b426	keep	exp142: gamma=0.07	0.8180	0.8306	0.8192	0.7440
ce2eb78	discard	exp143: gamma=0.08	0.8178	N/A	N/A	N/A
aa1dfdf	keep	exp144: n_estimators=1300	0.8182	0.8308	0.8194	0.7440
cdca991	keep	exp145: n_estimators=1400	0.8185	0.8310	0.8197	0.7439
6d7f58a	keep	exp146: n_estimators=1500	0.8186	0.8312	0.8198	0.7438
d85764c	keep	exp147: n_estimators=1600	0.8187	0.8313	0.8199	0.7436
9114525	crash	exp148: n_estimators=1800 OOM	0.0000	N/A	N/A	N/A
da284a4	keep	exp149: n_estimators=1700	0.8189	0.8315	0.8200	0.7436
4bb747e	discard	exp150: n_estimators=1750 (tied)	0.8189	N/A	N/A	N/A
32e1a8e	discard	exp151: lr=0.025 n_jobs=2 (tied)	0.8189	N/A	N/A	N/A
9aef065	discard	exp152: gamma=0.1	0.8186	N/A	N/A	N/A
60293de	discard	exp153: max_depth=20	0.8184	N/A	N/A	N/A
eb02431	discard	exp154: colsample_bytree=0.35	0.8186	N/A	N/A	N/A
8224075	crash	exp155: subsample=0.97 OOM	0.0000	N/A	N/A	N/A
041519d	discard	exp156: 2000 trees max_bin=1024	0.8184	N/A	N/A	N/A
aadbda8	discard	exp157: lr=0.035 (tied)	0.8189	N/A	N/A	N/A
d6624b5	discard	exp158: gamma=0.1 1800 trees	0.8186	N/A	N/A	N/A
97409a6	discard	exp159: min_child_weight=4	0.8177	N/A	N/A	N/A
2dc75a8	discard	exp160: reg_lambda=1.2	0.8186	N/A	N/A	N/A
8c04059	crash	exp161: gamma=0.06 OOM	0.0000	N/A	N/A	N/A
5526160	discard	exp162: max_depth=22	0.8185	N/A	N/A	N/A
0c45835	discard	exp163: subsample=0.93	0.8184	N/A	N/A	N/A
f946c8a	discard	exp164: colsample_bytree=0.42 (tied)	0.8189	N/A	N/A	N/A
f0f9208	crash	exp165: 1650 trees lr=0.028 OOM	0.0000	N/A	N/A	N/A
adc68d8	discard	exp166: lr=0.025 n_jobs=1 (tied)	0.8189	N/A	N/A	N/A
9206755	keep	exp167: n_estimators=2000 max_bin=1536 n_jobs=1	0.8190	CRASH	CRASH	CRASH
a4829c6	discard	exp168: 2500 trees max_bin=1024	0.8185	N/A	N/A	N/A
f7c3e2e	discard	exp169: 2200 trees max_bin=1280	0.8186	N/A	N/A	N/A
a386acc	crash	exp170: lr=0.025 with 2000 trees OOM	0.0000	N/A	N/A	N/A
6a25bcb	discard	exp171: gamma=0.08 with 2000 trees	0.8187	N/A	N/A	N/A
4555dc6	discard	exp172: colsample_bytree=0.38 (tied)	0.8190	N/A	N/A	N/A
adc806b	discard	exp173: max_depth=22 with 2000 trees	0.8185	N/A	N/A	N/A
3743588	discard	exp174: subsample=0.9 with 2000 trees	0.8182	N/A	N/A	N/A
d1d64ba	crash	exp175: min_child_weight=2 OOM	0.0000	N/A	N/A	N/A
7d5b150	discard	exp176: reg_lambda=0.8	0.8187	N/A	N/A	N/A
baddd47	discard	exp177: max_bin=1792 (tied)	0.8190	N/A	N/A	N/A
29a77f4	discard	exp178: lr=0.035 with 2000 trees	0.8189	N/A	N/A	N/A
a1eb30d	discard	exp179: n_estimators=2100 (tied)	0.8190	N/A	N/A	N/A
e7b05c6	discard	exp180: remove DepTime (still helpful with colsample=0.4)	0.8186	N/A	N/A	N/A
b7c3f53	discard	exp181: colsample_bytree=0.43 (tied)	0.8190	N/A	N/A	N/A
e93ac68	discard	exp182: 2500 trees depth=20	0.8185	N/A	N/A	N/A
f82f64d	discard	exp183: max_depth=26	0.8188	N/A	N/A	N/A
