commit	status	description	cv_auc	test_auc_2005s2_full	test_auc_2005s2_4_5	test_auc_2006_full
7d0b368	keep	baseline unchanged starter model	0.7445	0.7479	0.7454	0.7155
826568d	keep	120 trees lower learning rate explicit hist auc metric	0.7513	0.7552	0.7517	0.7163
f76c3b0	keep	200 trees at 0.03 learning rate	0.7517	0.7556	0.7524	0.7165
8fc0379	discard	reduce max_depth to 4	0.7462	N/A	N/A	N/A
cc49859	keep	increase max_depth to 8	0.7552	0.7601	0.7560	0.7149
11f1073	keep	increase max_depth to 10	0.7595	0.7642	0.7600	0.7140
3c01149	keep	increase max_depth to 12	0.7628	0.7691	0.7633	0.7153
45c7db5	keep	increase max_depth to 14	0.7657	0.7719	0.7662	0.7156
77ade59	keep	add min_child_weight 5 to deep trees	0.7731	0.7799	0.7740	0.7203
6c34e12	keep	raise min_child_weight to 10	0.7747	0.7803	0.7750	0.7207
4aa4e92	discard	raise min_child_weight to 20	0.7727	N/A	N/A	N/A
7637437	discard	max_cat_to_onehot 16 for small categoricals	0.7746	N/A	N/A	N/A
2ed0c2d	discard	max_cat_threshold 32 for categorical regularization	0.7745	N/A	N/A	N/A
0fac8f8	keep	add departure time derived numeric and cyclic features	0.7804	0.7879	0.7821	0.7265
841d3a5	discard	add high-cardinality route categorical feature	0.7793	N/A	N/A	N/A
60714b8	discard	add cyclic calendar and weekend features	0.7802	N/A	N/A	N/A
7ed1b2a	keep	raise max_depth to 16 with time features	0.7818	0.7891	0.7834	0.7265
819cae3	keep	raise max_depth to 18 with time features	0.7825	0.7902	0.7841	0.7262
97192af	keep	raise max_depth to 20 with time features	0.7827	0.7906	0.7841	0.7265
ce852e8	discard	raise min_child_weight to 15	0.7807	N/A	N/A	N/A
8f4d69d	keep	300 trees at 0.02 learning rate	0.7831	0.7914	0.7847	0.7277
9869075	keep	add subsample 0.9	0.7838	0.7911	0.7850	0.7281
e9844a0	discard	lower subsample to 0.8	0.7826	N/A	N/A	N/A
b768081	keep	light subsample 0.95	0.7840	0.7918	0.7851	0.7284
798390e	keep	add colsample_bytree 0.9	0.7870	0.7956	0.7889	0.7304
847e7a3	keep	lower colsample_bytree to 0.8	0.7897	0.7977	0.7907	0.7322
89c886f	keep	lower colsample_bytree to 0.7	0.7907	0.7994	0.7921	0.7335
a15efee	keep	lower colsample_bytree to 0.6	0.7935	0.8026	0.7947	0.7368
3642af5	discard	lower colsample_bytree to 0.5	0.7926	N/A	N/A	N/A
31a6b74	discard	colsample_bytree 0.55 tied best	0.7935	N/A	N/A	N/A
4766104	discard	colsample_bytree 0.65	0.7919	N/A	N/A	N/A
cb64df2	discard	add colsample_bynode 0.9	0.7931	N/A	N/A	N/A
badf2cc	discard	add gamma 0.1 split regularization	0.7935	N/A	N/A	N/A
81514b9	discard	raise reg_lambda to 2	0.7920	N/A	N/A	N/A
9f82898	discard	grow_policy lossguide max_leaves 512	0.7893	N/A	N/A	N/A
172aec3	discard	remove cyclic departure time features	0.7921	N/A	N/A	N/A
3c09a6b	keep	lower reg_lambda to 0.5	0.7938	0.8031	0.7950	0.7369
9f9a739	keep	lower reg_lambda to 0.25	0.7939	0.8035	0.7952	0.7369
5274663	keep	remove reg_lambda	0.7945	0.8038	0.7957	0.7372
35a3c3c	keep	raise max_depth to 22 with no l2	0.7947	0.8043	0.7962	0.7372
c231b8f	keep	raise max_depth to 24 with no l2	0.7950	0.8045	0.7963	0.7376
ce57e9a	discard	max_bin 512	0.7945	N/A	N/A	N/A
00ba05f	discard	max_bin 128	0.7945	N/A	N/A	N/A
88d1710	discard	raise max_depth to 26	0.7946	N/A	N/A	N/A
d81c3a3	discard	add log and sqrt distance transforms	0.7935	N/A	N/A	N/A
ef147ce	discard	add 3-hour departure period categorical	0.7937	N/A	N/A	N/A
7b45d65	keep	400 trees at 0.015 learning rate	0.7957	0.8052	0.7969	0.7373
df5ce5b	keep	500 trees at 0.012 learning rate	0.7958	0.8053	0.7974	0.7378
2b7c718	keep	600 trees at 0.01 learning rate	0.7969	0.8062	0.7981	0.7385
dbb8154	keep	700 trees at 0.0085 learning rate	0.7970	0.8061	0.7984	0.7385
0efcc89	keep	700 trees at 0.009 learning rate	0.7974	0.8071	0.7990	0.7387
f67e930	keep	700 trees at 0.0095 learning rate	0.7986	0.8081	0.7997	0.7388
eb524e5	keep	700 trees at 0.01 learning rate	0.7992	0.8088	0.8005	0.7388
47dcfbe	keep	700 trees at 0.011 learning rate	0.8003	0.8102	0.8017	0.7387
6ef12b1	keep	700 trees at 0.012 learning rate	0.8012	0.8113	0.8029	0.7383
71510ad	keep	700 trees at 0.013 learning rate	0.8024	0.8123	0.8037	0.7384
d423a3e	keep	700 trees at 0.014 learning rate	0.8029	0.8132	0.8046	0.7384
0d7e7d8	keep	700 trees at 0.015 learning rate	0.8037	0.8140	0.8051	0.7379
6fbd86b	keep	700 trees at 0.016 learning rate	0.8042	0.8145	0.8055	0.7378
31eed32	keep	700 trees at 0.017 learning rate	0.8046	0.8150	0.8060	0.7378
293d2eb	keep	700 trees at 0.018 learning rate	0.8050	0.8153	0.8063	0.7378
89e4b20	keep	700 trees at 0.019 learning rate	0.8053	0.8158	0.8068	0.7373
77fe758	keep	700 trees at 0.02 learning rate	0.8057	0.8162	0.8071	0.7374
18875f1	keep	700 trees at 0.022 learning rate	0.8061	0.8169	0.8072	0.7372
ca7ade5	keep	700 trees at 0.024 learning rate	0.8065	0.8169	0.8081	0.7365
0f89874	keep	700 trees at 0.026 learning rate	0.8069	0.8174	0.8080	0.7363
e4e996f	discard	700 trees at 0.028 learning rate tied best	0.8069	N/A	N/A	N/A
5d04a51	discard	700 trees at 0.027 learning rate	0.8068	N/A	N/A	N/A
7a30d08	keep	lower min_child_weight to 8 at eta peak	0.8077	0.8186	0.8087	0.7370
b23af85	keep	lower min_child_weight to 6	0.8088	0.8196	0.8097	0.7377
6c8f200	crash	min_child_weight 4 timed out	0.0000	N/A	N/A	N/A
36fbc5f	discard	650 trees at 0.028 learning rate	0.8084	N/A	N/A	N/A
b4dc670	discard	650 trees at 0.03 learning rate	0.8079	N/A	N/A	N/A
90817d6	discard	reduce max_depth to 22 at best settings	0.8084	N/A	N/A	N/A
9825fb5	discard	colsample_bytree 0.55 tied best	0.8088	N/A	N/A	N/A
60424a9	discard	remove row subsampling	0.8082	N/A	N/A	N/A
8634ad3	discard	lower subsample to 0.9	0.8082	N/A	N/A	N/A
9661382	keep	max_cat_to_onehot 32	0.8201	0.8337	0.8221	0.7478
633d32a	discard	max_cat_to_onehot 24	0.8112	N/A	N/A	N/A
86bf145	discard	max_cat_to_onehot 512	0.7996	N/A	N/A	N/A
0cde539	keep	max_cat_threshold 128	0.8205	0.8341	0.8225	0.7481
4f9c89e	discard	max_cat_threshold 256 too slow	0.8206	N/A	N/A	N/A
5cdb54d	keep	max_cat_threshold 192	0.8210	0.8343	0.8224	0.7481
65bcc64	discard	max_cat_threshold 224	0.8206	N/A	N/A	N/A
4b59664	discard	max_cat_threshold 208	0.8205	N/A	N/A	N/A
4db273f	discard	max_cat_threshold 176	0.8206	N/A	N/A	N/A
0e2522e	discard	learning_rate 0.028 after categorical retune	0.8208	N/A	N/A	N/A
c1043d5	discard	learning_rate 0.025 tied best	0.8210	N/A	N/A	N/A
9a47a2e	discard	min_child_weight 5 too slow	0.8217	N/A	N/A	N/A
4348ec4	keep	min_child_weight 5 with 650 trees at 0.028	0.8213	0.8358	0.8234	0.7488
288a65a	keep	min_child_weight 5 with 650 trees at 0.029	0.8220	0.8355	0.8238	0.7487
64e6baf	discard	min_child_weight 5 with 650 trees at 0.03	0.8212	N/A	N/A	N/A
0eb7d08	discard	min_child_weight 5 with 650 trees at 0.0295	0.8214	N/A	N/A	N/A
6844416	discard	max_cat_threshold 224 after schedule retune	0.8214	N/A	N/A	N/A
8d046f2	discard	colsample_bytree 0.65 too slow	0.8224	N/A	N/A	N/A
caee7f9	discard	colsample_bytree 0.625 too slow	0.8224	N/A	N/A	N/A
f657d61	discard	625 trees 0.03 eta colsample 0.625 tied best	0.8220	N/A	N/A	N/A
7f25d47	keep	625 trees 0.031 eta colsample 0.625	0.8222	0.8363	0.8240	0.7483
aa69176	discard	625 trees 0.032 eta colsample 0.625	0.8216	N/A	N/A	N/A
d50ebcf	discard	625 trees 0.0315 eta colsample 0.625	0.8221	N/A	N/A	N/A
ee795c9	discard	600 trees 0.033 eta colsample 0.65	0.8219	N/A	N/A	N/A
9f7fc42	discard	add reg_alpha 0.1	0.8221	N/A	N/A	N/A
e6d7405	discard	min_child_weight 4 with 600 trees too slow	0.8233	N/A	N/A	N/A
5e7303b	keep	min_child_weight 4 with 575 trees at 0.0345	0.8233	0.8374	0.8247	0.7487
8099ed5	discard	min_child_weight 4 with 575 trees at 0.0355	0.8226	N/A	N/A	N/A
782cb30	discard	min_child_weight 4 with 575 trees at 0.034	0.8230	N/A	N/A	N/A
680e55a	discard	min_child_weight 4 with 550 trees at 0.036	0.8227	N/A	N/A	N/A
731dacd	discard	max_cat_threshold 224 with child_weight 4	0.8230	N/A	N/A	N/A
7c2f90a	discard	subsample 0.9 with child_weight 4	0.8224	N/A	N/A	N/A
cf33d9a	discard	colsample_bytree 0.65 tied best	0.8233	N/A	N/A	N/A
c1ce7cb	discard	max_depth 26 tied best too slow	0.8233	N/A	N/A	N/A
4e88375	keep	add categorical departure hour	0.8238	0.8382	0.8251	0.7491
0c48fdb	discard	add categorical departure quarter	0.8236	N/A	N/A	N/A
f0f408c	discard	remove raw departure hour tied best	0.8238	N/A	N/A	N/A
11631fa	discard	remove raw departure time	0.8229	N/A	N/A	N/A
0f11483	discard	gamma 0.05 split-loss regularization	0.8234	N/A	N/A	N/A
ad96f34	keep	learning_rate 0.0348 with DepHourCat	0.8240	0.8383	0.8252	0.7493
8f82f0f	discard	585 trees at learning_rate 0.0342	0.8237	N/A	N/A	N/A
08a837d	discard	learning_rate 0.0351	0.8233	N/A	N/A	N/A
a04c88b	discard	learning_rate 0.0347	0.8234	N/A	N/A	N/A
06f30d9	discard	colsample_bylevel 0.9	0.8234	N/A	N/A	N/A
3712049	discard	lossguide growth with max_leaves 512	0.8158	N/A	N/A	N/A
b40ee6d	discard	max_depth 23	0.8231	N/A	N/A	N/A
5ae4698	discard	distance quantile bins	0.8236	N/A	N/A	N/A
3edc009	discard	carrier weekday categorical interaction	0.8047	N/A	N/A	N/A
aa6a093	discard	570 trees at learning_rate 0.035	0.8235	N/A	N/A	N/A
422eacb	discard	subsample 0.975 over runtime cap	0.8241	N/A	N/A	N/A
63834f3	discard	subsample 0.97 over runtime cap	0.8238	N/A	N/A	N/A
5eef80d	discard	subsample 0.965 over runtime cap	0.8238	N/A	N/A	N/A
2137b2e	discard	colsample_bytree 0.6 over runtime cap	0.8240	N/A	N/A	N/A
e5726e3	discard	570 trees with subsample 0.975 over runtime cap	0.8241	N/A	N/A	N/A
