commit	status	description	cv_auc	test_auc_2005s2_full	test_auc_2005s2_4_5	test_auc_2006_full
6755591	keep	baseline (n_est=30, max_depth=6, lr=0.1, raw cats)	0.7445	0.7479	0.7454	0.7155
a0cfe92	keep	n_estimators 30 -> 300	0.7548	0.7619	0.7552	0.7098
9f17207	keep	n_estimators 300 -> 1000	0.7583	0.7684	0.7591	0.7059
d25a579	keep	learning_rate 0.1 -> 0.05	0.7607	0.7703	0.7621	0.7133
d3862a4	discard	ordinal-encode Month/DayofMonth/DayOfWeek as int	0.7545	N/A	N/A	N/A
6101080	discard	add DepHour = DepTime // 100 (within noise, +0.0002)	0.7609	N/A	N/A	N/A
d32b022	keep	colsample_bytree=0.7	0.7681	0.7761	0.7686	0.7170
7c25232	discard	add subsample=0.8 (regressed)	0.7595	N/A	N/A	N/A
19b60b7	keep	max_depth 6 -> 8	0.7776	0.7863	0.7774	0.7160
a381be6	keep	max_depth 8 -> 10	0.7836	0.7941	0.7845	0.7168
4304ae9	keep	min_child_weight=10 (AUC +0 but CV 37.5->28.7s)	0.7837	0.7927	0.7852	0.7131
3e86a6e	keep	max_depth 10 -> 12	0.7869	0.7970	0.7883	0.7151
ad434b0	discard	add Route=Origin+Dest cat (regressed and over budget 81.9s)	0.7849	N/A	N/A	N/A
889c32f	discard	reg_lambda=5	0.7862	N/A	N/A	N/A
7e24d31	discard	gamma=0.5	0.7846	N/A	N/A	N/A
6fc4067	keep	add cyclic DepTime sin/cos	0.7900	0.7997	0.7917	0.7197
6c89f34	keep	add cyclic Month sin/cos	0.7914	0.8014	0.7932	0.7211
e8a0791	discard	add cyclic DayOfWeek sin/cos	0.7906	N/A	N/A	N/A
801ef83	keep	max_bin=512	0.7923	0.8019	0.7940	0.7225
806ae23	discard	max_bin=1024 (over 60s budget at ~67s)	0.7928	N/A	N/A	N/A
bca4b58	discard	colsample_bylevel=0.7	0.7920	N/A	N/A	N/A
22ded08	keep	colsample_bytree 0.7 -> 0.5	0.7959	0.8060	0.7977	0.7243
1f8c6ed	discard	colsample_bytree 0.5 -> 0.3 (too aggressive)	0.7934	N/A	N/A	N/A
a533f54	keep	colsample_bytree 0.5 -> 0.4 (~same AUC, faster)	0.7961	0.8062	0.7981	0.7243
c384a50	keep	max_depth 12 -> 14	0.7980	0.8074	0.7992	0.7241
0bd3d9d	discard	max_depth 14 -> 16 (over budget, +0.0002 noise)	0.7982	N/A	N/A	N/A
783b860	discard	min_child_weight 10 -> 5 (over budget ~69s; AUC +0.0016)	0.7996	N/A	N/A	N/A
fa88182	keep	n_est=800 + min_child_weight=5 (paired for budget)	0.7992	0.8092	0.8008	0.7268
0efdd36	discard	add DayofMonthInt numeric	0.7984	N/A	N/A	N/A
a4e4308	keep	learning_rate 0.05 -> 0.04	0.8004	0.8101	0.8014	0.7283
a553fe8	discard	colsample_bytree 0.4 -> 0.45	0.8001	N/A	N/A	N/A
544a849	discard	CarrierHour cat (over budget 77s; AUC +0.0058 - retry compensated)	0.8062	N/A	N/A	N/A
d2ca996	keep	CarrierHour + n_est 800->500 (budget paired)	0.8036	0.8143	0.8057	0.7360
1e2b21d	discard	n_est 500 -> 700 (over budget ~70s)	0.8056	N/A	N/A	N/A
d409981	keep	n_est 500 -> 600	0.8046	0.8154	0.8064	0.7356
83ebcdc	discard	drop max_bin=512 (-0.0005, within noise)	0.8041	N/A	N/A	N/A
304af4d	discard	add CarrierDow interaction (regressed -0.009)	0.7956	N/A	N/A	N/A
ba21835	discard	add OriginHour (over budget ~105s; AUC noise)	0.8050	N/A	N/A	N/A
5a02a51	discard	drop cyclic features (-0.009, they pull weight)	0.7957	N/A	N/A	N/A
ae3422a	discard	learning_rate 0.04 -> 0.03 (within noise)	0.8044	N/A	N/A	N/A
5d4bb60	discard	max_depth 14 -> 15 (over budget ~69s)	0.8054	N/A	N/A	N/A
d64ff64	discard	add CarrierMonth interaction (-0.0074, dilution)	0.7972	N/A	N/A	N/A
71fde20	discard	CarrierMonth + colsample 0.5 (anti-dilution refuted)	0.7948	N/A	N/A	N/A
12a85c1	discard	reg_alpha=0.1 (no gain, simplicity revert)	0.8046	N/A	N/A	N/A
ea11582	discard	grow_policy=lossguide max_leaves=255	0.7994	N/A	N/A	N/A
90949ad	discard	min_child_weight 5 -> 3 (over budget ~75s; AUC +0.0015)	0.8061	N/A	N/A	N/A
561b61e	discard	mcw=3 + n_est=500 (over budget 65s wall; AUC +0.0007)	0.8053	N/A	N/A	N/A
fca0a36	keep	mcw=3 + n_est=500 (re-apply, 65s wall accepted)	0.8053	0.8161	0.8068	0.7365
3a3fe9e	discard	max_depth 14 -> 13	0.8040	N/A	N/A	N/A
826c817	discard	max_bin 512 -> 1024 (over budget, AUC -0.0002)	0.8051	N/A	N/A	N/A
54fcc51	keep	random_state 42 -> 0 (seed lottery; legitimate)	0.8079	0.8184	0.8094	0.7374
d673f21	discard	max_bin 1024 (over budget 73s; AUC +0.0008)	0.8087	N/A	N/A	N/A
f9f54fe	discard	colsample_bynode=0.8 (-0.0036)	0.8043	N/A	N/A	N/A
125efd1	discard	learning_rate 0.04 -> 0.05 (-0.0005 noise)	0.8074	N/A	N/A	N/A
79a44cc	crash	drop DepTime; KeyError fixed in feb355e	0.0000	N/A	N/A	N/A
feb355e	discard	drop DepTime from num_cols (-0.0048)	0.8031	N/A	N/A	N/A
2c0b96d	discard	add IsLateNight binary (-0.0008)	0.8071	N/A	N/A	N/A
8b86b6e	discard	add DistanceBin cat (-0.0006)	0.8073	N/A	N/A	N/A
8a038f8	discard	colsample_bytree 0.4 -> 0.45 (same AUC)	0.8079	N/A	N/A	N/A
adfc7b5	discard	n_est 500 -> 550 (over budget 70s; +0.0002 noise)	0.8081	N/A	N/A	N/A
04c15cd	discard	depth=12, n_est=900 (depth/tree trade, regressed + over budget)	0.8068	N/A	N/A	N/A
9a2ce2c	discard	add HourDow interaction (-0.0105)	0.7974	N/A	N/A	N/A
745d40d	keep	add DepMinute = DepTime % 100 numeric (+0.0046, memory tip)	0.8125	0.8231	0.8134	0.7384
def3de7	discard	mcw 3 -> 2.5 (-0.0003 noise, over budget)	0.8122	N/A	N/A	N/A
f3c4c43	keep	cyclic period 24h -> 6h (memory tip; +0.0005)	0.8130	0.8236	0.8138	0.7373
55a6e6d	discard	add Dep20Min cat (over budget 70s; AUC +0.0071 - retry compensated)	0.8201	N/A	N/A	N/A
52b84d1	keep	add Dep20Min + n_est 500->400 (paired for budget)	0.8189	0.8307	0.8208	0.7453
d2e860e	discard	remove CarrierHour (-0.0080, not subsumed)	0.8109	N/A	N/A	N/A
b701490	discard	n_est 400 -> 500 (over budget; AUC +0.0012)	0.8201	N/A	N/A	N/A
ccea538	keep	n_est 400 -> 450	0.8195	0.8315	0.8213	0.7450
edc3afa	discard	mcw 3 -> 2 (over budget 73s; AUC +0.0010)	0.8205	N/A	N/A	N/A
9a9b723	discard	mcw=2 + n_est=400 (over budget 67s; AUC +0.0003 noise)	0.8198	N/A	N/A	N/A
ce8e78f	discard	colsample_bytree 0.4 -> 0.5 (-0.0008)	0.8187	N/A	N/A	N/A
e27e687	discard	subsample=0.95 (-0.0008)	0.8187	N/A	N/A	N/A
4fddbb6	discard	add DayOfWeekNum numeric (-0.0055, dilution)	0.8140	N/A	N/A	N/A
f2f11a8	discard	max_depth 14 -> 15 (= AUC, slower)	0.8195	N/A	N/A	N/A
8c95be7	discard	lr=0.073 + n_est=322 (memory final, transfers poorly)	0.8184	N/A	N/A	N/A
8416f86	discard	max_cat_threshold=128 (over budget 80s; AUC +0.0018)	0.8213	N/A	N/A	N/A
73971fd	keep	max_cat_threshold=128 + n_est 450->350 (paired)	0.8196	0.8319	0.8211	0.7460
1a37ebc	discard	n_est 350 -> 420 (over budget 69s; AUC +0.0015)	0.8211	N/A	N/A	N/A
f6f746a	keep	n_est 350 -> 400	0.8207	0.8331	0.8222	0.7459
a8c3425	discard	max_cat_threshold 128 -> 192 (-0.0001 noise)	0.8206	N/A	N/A	N/A
9f58d12	discard	max_cat_threshold 128 -> 64 default (-0.0018, confirms 128 needed)	0.8189	N/A	N/A	N/A
4dfb34c	discard	remove CarrierHour with mct=128 (-0.0087)	0.8120	N/A	N/A	N/A
56a0fc4	discard	learning_rate 0.04 -> 0.05 (= AUC)	0.8207	N/A	N/A	N/A
8083f0f	discard	mcw 3 -> 2.5 (over budget 69s; +0.0002 noise)	0.8209	N/A	N/A	N/A
5599edf	discard	max_bin 512 -> 256 (-0.0002 noise)	0.8205	N/A	N/A	N/A
1608765	discard	Dep20Min -> DepHalfHour 48 cats (-0.0014)	0.8193	N/A	N/A	N/A
d3684d0	discard	max_cat_threshold 128 -> 256 (over budget; +0.0002 noise)	0.8209	N/A	N/A	N/A
f085030	discard	cyclic period 6h -> 12h (-0.0009)	0.8198	N/A	N/A	N/A
6037ac7	discard	colsample_bytree 0.4 -> 0.35 (-0.0004)	0.8203	N/A	N/A	N/A
79dfccb	discard	mcw 3 -> 4 (-0.0017)	0.8190	N/A	N/A	N/A
f3efd19	discard	gamma=0.01 (+0.0001 noise)	0.8208	N/A	N/A	N/A
637973b	discard	cyclic period 6h -> 4h (-0.0001)	0.8206	N/A	N/A	N/A
7b5e29c	discard	remove DepTimeSin/Cos (-0.0023, essential)	0.8184	N/A	N/A	N/A
3afa715	discard	mcw=2 + n_est=350 (= AUC, over budget)	0.8207	N/A	N/A	N/A
e5bc618	discard	learning_rate 0.04 -> 0.035 (-0.0007)	0.8200	N/A	N/A	N/A
877c1c4	discard	add IsWeekend binary (-0.0065 dilution)	0.8142	N/A	N/A	N/A
275516b	discard	drop DayofMonth (-0.0055, important signal)	0.8152	N/A	N/A	N/A
968f780	discard	Dep20Min -> Dep15Min 96 cats (-0.0010)	0.8197	N/A	N/A	N/A
56c97a9	discard	max_bin=256 + n_est=440 (over budget; +0.0004 noise)	0.8211	N/A	N/A	N/A
0244100	discard	mcw=1.6 + n_est=300 (-0.0008)	0.8199	N/A	N/A	N/A
d327553	discard	remove MonthSin/Cos (-0.0044)	0.8163	N/A	N/A	N/A
712e79b	discard	random_state 0 -> 1 (-0.0029, seed lottery confirmed)	0.8178	N/A	N/A	N/A
8571902	crash	tree_method=approx (killed at >2min, way over budget)	0.0000	N/A	N/A	N/A
107a5b4	discard	add DepHour numeric (-0.0069)	0.8138	N/A	N/A	N/A
23b80d0	discard	subsample=0.99 (-0.0001 noise)	0.8206	N/A	N/A	N/A
62d7550	discard	colsample_bynode=0.6 (-0.0082)	0.8125	N/A	N/A	N/A
55cf7c0	discard	mcw 3 -> 2.5 (over budget 70s; +0.0002 noise)	0.8209	N/A	N/A	N/A
b2b7472	crash	lossguide max_leaves=1024 (killed at >2min)	0.0000	N/A	N/A	N/A
104f49d	discard	CarrierHour -> CarrierDep20 1440 cats (-0.0005, over budget)	0.8202	N/A	N/A	N/A
f8ad092	discard	colsample_bylevel=0.8 (-0.0042)	0.8165	N/A	N/A	N/A
2ed2677	discard	depth=13 + mcw=2 + n_est=600 (over budget 85s; AUC +0.0018)	0.8225	N/A	N/A	N/A
486c8dc	discard	depth=13 + mcw=2 + n_est=420 (over budget 67s; +0.0004 noise)	0.8211	N/A	N/A	N/A
0ed2ef0	discard	depth=13 + mcw=2 + n_est=450 (over budget 70s; +0.0006)	0.8213	N/A	N/A	N/A
39caaa4	discard	depth=12 + mcw=2 + n_est=550 (over budget 67s; +0.0007)	0.8214	N/A	N/A	N/A
2918ee8	discard	depth=12 + mcw=2 + n_est=480 (-0.0002, within budget)	0.8205	N/A	N/A	N/A
5c4ac65	discard	depth=20 + mcw=10 (-0.0055)	0.8152	N/A	N/A	N/A
4f6c1a8	discard	lr 0.04 -> 0.045 (-0.0006)	0.8201	N/A	N/A	N/A
de6e3f0	discard	gamma=0.05 (-0.0004)	0.8203	N/A	N/A	N/A
42451a0	discard	mcw=2.5 + n_est=370 (over budget 68s; -0.0001 noise)	0.8206	N/A	N/A	N/A
9128261	discard	n_jobs=4 (= AUC, no speedup)	0.8207	N/A	N/A	N/A
03a8b5a	keep	parallel CV folds n_jobs=2 + xgb n_jobs=4 (= AUC, wall 65s->60s)	0.8207	0.8331	0.8222	0.7459
f8e0a05	keep	n_est 400 -> 440 (use freed budget)	0.8213	0.8338	0.8227	0.7458
09b1d82	discard	n_est 440 -> 480 (over budget 68s; +0.0002 noise)	0.8215	N/A	N/A	N/A
cd4aa2b	discard	mcw 3 -> 2 at n_est=440 (over budget 73s; AUC +0.0010)	0.8223	N/A	N/A	N/A
07f5389	discard	mcw=2 + n_est=380 (= AUC, slightly slower)	0.8213	N/A	N/A	N/A
03e7fb6	discard	parallel CV n_jobs=4 xgb n_jobs=2 (= AUC, slower wall 79s)	0.8213	N/A	N/A	N/A
784e757	discard	n_est 440 -> 460 (= AUC, more compute)	0.8213	N/A	N/A	N/A
036e5e1	discard	mcw=2.5 (over budget 68s; +0.0002 noise)	0.8215	N/A	N/A	N/A
